<?xml version="1.0" encoding="UTF-8"?>
<xs:schema xmlns:xs="http://www.w3.org/2001/XMLSchema">
<xs:element name="cartelera">
<xs:complexType>
<xs:sequence>
<xs:element name="ticket" maxOccurs="unbounded">
<xs:complexType>
<xs:sequence>
<xs:element name="pelicula" type="xs:string"/>
<xs:element name="fecha" type="xs:date"/>
<xs:element name="sala">
<xs:simpleType>
<xs:restriction base="xs:integer">
<xs:minInclusive value="1"/>
<xs:maxInclusive value="15"/>
</xs:restriction>
</xs:simpleType>
</xs:element>
</xs:sequence>
<xs:attribute name="id" type="xs:ID" use="required"/>
</xs:complexType>
</xs:element>
</xs:sequence>
</xs:complexType>
</xs:element>
</xs:schema>