<?xml version="1.0" encoding="UTF-8"?>
<cartelera xmlns:xsi="http://www.w3.org/2001/XMLSchema-instance"
           xsi:noNamespaceSchemaLocation="ticket.xsd">

    <ticket id="t1">
        <pelicula>Torrente, presidente</pelicula>
        <fecha>2026-03-13</fecha>
        <sala>5</sala>
    </ticket>

    <ticket id="t2">
        <pelicula>Padre no hay más que uno 5</pelicula>
        <fecha>2025-06-26</fecha>
        <sala>10</sala>
    </ticket>

</cartelera>